{
  "id": "LIS-29cf05f5-test_0-S1-Q08",
  "module": "LISTENING",
  "testId": "LIS-29cf05f5-test_0",
  "testType": "ACADEMIC",
  "sectionId": "LIS-29cf05f5-test_0-S1",
  "sectionNumber": 1,
  "passageId": null,
  "passageNumber": null,
  "groupId": "LIS-29cf05f5-test_0-S1-G2",
  "questionNumber": 8,
  "questionType": "NOTE_COMPLETION",
  "inputType": "INLINE_BLANK",
  "prompt": "• [INLINE_INPUT_8] included",
  "options": [],
  "sharedInstruction": "Questions 6-10Complete the notes below. WriteNO MORE THAN TWO WORDS AND/ OR A NUMBERfor each answer.",
  "sharedContent": "<p class=\"wp-block-paragraph\"><strong>Maria Cristina</strong><br/>• Spanish boat<br/>• Starts in Barcelona<br/>• Cost – $10,500 (not including <strong>(6)</strong> <input name=\"fname\" type=\"text\"/>)<br/>• All foods and drinks included<br/>• Inside cabin (upgrade to sea view for $800)<br/>• On board cinema (different films every night)<br/>• <strong>(7)</strong> <input name=\"fname\" type=\"text\"/>on destinations<br/>• Classes (ie. Painting, cooking, art appreciation and others)<br/>• <strong>(8)</strong> <input name=\"fname\" type=\"text\"/>included</p><p class=\"wp-block-paragraph\"><strong>Sea Queen</strong><br/>• Spanish boat<br/>• Starts in Marseille<br/>• Length – 2.5 week cruise<br/>• Cost – $<strong>(9)</strong> <input name=\"fname\" type=\"text\"/> (including flights)<br/>• Sea view cabin<br/>• Food included but not drinks<br/>• Cinema<br/>• <strong>(10)</strong> <input name=\"fname\" type=\"text\"/> + gym</p><p class=\"wp-block-paragraph\"><br/><br/></p>",
  "correctAnswer": "UNKNOWN",
  "audioId": "ed3072ec64d5",
  "audioPath": "assets/ed3072ec64d5.mp3",
  "tableData": null,
  "sourceEvidence": {
    "sourceFile": "/Users/arunyagoojar/Downloads/ielts-website/listening-15/index.html",
    "sourceHash": "29cf05f56e32d9eff9b4349c809f5cd92800c196d66f485f1ab1e60338ac9b8d"
  },
  "status": "VERIFIED"
}