{
  "id": "LIS-f2c22f97-test_0-S2-Q11",
  "module": "LISTENING",
  "testId": "LIS-f2c22f97-test_0",
  "testType": "ACADEMIC",
  "sectionId": "LIS-f2c22f97-test_0-S2",
  "sectionNumber": 2,
  "passageId": null,
  "passageNumber": null,
  "groupId": "LIS-f2c22f97-test_0-S2-G1",
  "questionNumber": 11,
  "questionType": "MULTIPLE_CHOICE_MULTI",
  "inputType": "MULTI_SELECT",
  "prompt": "WhichTWOthings does Alice say about the Dolphin Conservation Trust?AChildren make up most of the membershipBIt’s the country’s largest conservation organisationCIt helps finance campaigns for changes in fishing practicesDIt employs several dolphin experts full-timeEVolunteers help in various ways",
  "options": [
    "A Children make up most of the membership",
    "B It’s the country’s largest conservation organisation",
    "C It helps finance campaigns for changes in fishing practices",
    "D It employs several dolphin experts full-time",
    "E Volunteers help in various ways"
  ],
  "sharedInstruction": "Part 2: Questions 11 and 12ChooseTWOletters, A-E.",
  "sharedContent": "<p>Which <strong>TWO</strong> things does Alice say about the Dolphin Conservation Trust?<br/><strong><input type=\"checkbox\"/> A</strong> Children make up most of the membership<br/><strong><input type=\"checkbox\"/> B</strong> It’s the country’s largest conservation organisation<br/><strong><input type=\"checkbox\"/> C</strong> It helps finance campaigns for changes in fishing practices<br/><strong><input type=\"checkbox\"/> D</strong> It employs several dolphin experts full-time<br/><strong><input type=\"checkbox\"/> E</strong> Volunteers help in various ways</p>",
  "correctAnswer": "C",
  "audioId": "a0e30d751d12",
  "audioPath": "assets/a0e30d751d12.mp3",
  "tableData": null,
  "sourceEvidence": {
    "sourceFile": "/Users/arunyagoojar/Downloads/ielts-website/ielts-listening-test-143/index.html",
    "sourceHash": "f2c22f97790813acc1b6c0b6a9d2534e0a580435420e341adfdc5366b8cbc877"
  },
  "status": "VERIFIED"
}