{
  "id": "LIS-396854e1-test_0-S3-Q25",
  "module": "LISTENING",
  "testId": "LIS-396854e1-test_0",
  "testType": "ACADEMIC",
  "sectionId": "LIS-396854e1-test_0-S3",
  "sectionNumber": 3,
  "passageId": null,
  "passageNumber": null,
  "groupId": "LIS-396854e1-test_0-S3-G2",
  "questionNumber": 25,
  "questionType": "TABLE_COMPLETION",
  "inputType": "INLINE_BLANK",
  "prompt": "[INLINE_INPUT_25] (26)",
  "options": [],
  "sharedInstruction": "Questions 25-30Complete the table below. WriteONE WORDonly for each answer.",
  "sharedContent": "<table style=\"border-collapse: collapse; width: 100%; height: 144px;\"><tbody><tr style=\"height: 24px;\"><td style=\"width: 32.0281%; height: 24px; border-style: solid; border-color: #000000; text-align: center;\"><strong> Subject</strong></td><td style=\"width: 67.9719%; height: 24px; border-style: solid; border-color: #000000; text-align: center;\"><strong> Recommended page design</strong></td></tr><tr style=\"height: 24px;\"><td style=\"width: 32.0281%; height: 24px; border-style: solid; border-color: #000000;\"> (25) ……… studies</td><td style=\"width: 67.9719%; height: 24px; border-style: solid; border-color: #000000;\"> Flowchart showing courtroom processes and (26) ……..</td></tr><tr style=\"height: 24px;\"><td style=\"width: 32.0281%; height: 24px; border-style: solid; border-color: #000000;\"> Culture studies</td><td style=\"width: 67.9719%; height: 24px; border-style: solid; border-color: #000000;\"> Table or spider-graph, linking (27) ……….. thoughts etc.</td></tr><tr style=\"height: 24px;\"><td style=\"width: 32.0281%; height: 24px; border-style: solid; border-color: #000000;\"> Management theory</td><td style=\"width: 67.9719%; height: 24px; border-style: solid; border-color: #000000;\"> Network (like spider-graph but has (28) ………… )</td></tr><tr style=\"height: 24px;\"><td style=\"width: 32.0281%; height: 24px; border-style: solid; border-color: #000000;\"> Political science</td><td style=\"width: 67.9719%; height: 24px; border-style: solid; border-color: #000000;\"> Linear (29) ………..</td></tr><tr style=\"height: 24px;\"><td style=\"width: 32.0281%; height: 24px; border-style: solid; border-color: #000000;\"> Mass media</td><td style=\"width: 67.9719%; height: 24px; border-style: solid; border-color: #000000;\"> Just use (30) ………….</td></tr></tbody></table><p><strong>(25)</strong> <input name=\"fname\" type=\"text\"/>                <strong>(26)</strong> <input name=\"fname\" type=\"text\"/><br/><strong>(27)</strong> <input name=\"fname\" type=\"text\"/>                <strong>(28)</strong> <input name=\"fname\" type=\"text\"/><br/><strong>(29)</strong> <input name=\"fname\" type=\"text\"/>                <strong>(30)</strong> <input name=\"fname\" type=\"text\"/></p><p><br/></p>",
  "correctAnswer": "legal",
  "audioId": "ebb487a618af",
  "audioPath": "assets/ebb487a618af.mp3",
  "tableData": {
    "title": "",
    "headers": [],
    "rows": [
      [
        "Subject",
        "Recommended page design"
      ],
      [
        "(25) ……… studies",
        "Flowchart showing courtroom processes and (26) …….."
      ],
      [
        "Culture studies",
        "Table or spider-graph, linking (27) ……….. thoughts etc."
      ],
      [
        "Management theory",
        "Network (like spider-graph but has (28) ………… )"
      ],
      [
        "Political science",
        "Linear (29) ……….."
      ],
      [
        "Mass media",
        "Just use (30) …………."
      ]
    ]
  },
  "sourceEvidence": {
    "sourceFile": "/Users/arunyagoojar/Downloads/ielts-website/ielts-listening-test-62/index.html",
    "sourceHash": "396854e188e737d5c961537167825738b73c52feebe186abb9740305af290bd4"
  },
  "status": "VERIFIED"
}