{
  "id": "LIS-9d922d59-test_0-S4-Q32",
  "module": "LISTENING",
  "testId": "LIS-9d922d59-test_0",
  "testType": "ACADEMIC",
  "sectionId": "LIS-9d922d59-test_0-S4",
  "sectionNumber": 4,
  "passageId": null,
  "passageNumber": null,
  "groupId": "LIS-9d922d59-test_0-S4-G1",
  "questionNumber": 32,
  "questionType": "SHORT_ANSWER",
  "inputType": "TEXT",
  "prompt": "32. In Medieval Times what type of waste was most common? [BLANK]",
  "options": [],
  "sharedInstruction": "Part 4: Questions 31-34Answer the questions below. WriteNO MORE THAN ONE WORD AND/ OR A NUMBERfor each answer.",
  "sharedContent": "<p></p><p></p><p class=\"wp-block-paragraph\">31. Where was a Stone Age rubbish dump found? <input name=\"fname\" type=\"text\"/></p><p></p><p></p><p class=\"wp-block-paragraph\">32. In Medieval Times what type of waste was most common? <input name=\"fname\" type=\"text\"/></p><p></p><p></p><p class=\"wp-block-paragraph\">33. What did science link with waste? <input name=\"fname\" type=\"text\"/></p><p></p><p></p><p class=\"wp-block-paragraph\">34. Which invention is the biggest problem for the environment? <input name=\"fname\" type=\"text\"/></p><p></p><p></p>",
  "correctAnswer": "UNKNOWN",
  "audioId": "1227c2cda4a2",
  "audioPath": "assets/1227c2cda4a2.mp3",
  "tableData": null,
  "sourceEvidence": {
    "sourceFile": "/Users/arunyagoojar/Downloads/ielts-website/ielts-listening-test-40/index.html",
    "sourceHash": "9d922d59342b4c982245592943b769b8ffdeb7efff8b048755df2c86ab3bb2d4"
  },
  "status": "VERIFIED"
}