{
  "id": "LIS-c5a79191-test_0-S3-Q28",
  "module": "LISTENING",
  "testId": "LIS-c5a79191-test_0",
  "testType": "ACADEMIC",
  "sectionId": "LIS-c5a79191-test_0-S3",
  "sectionNumber": 3,
  "passageId": null,
  "passageNumber": null,
  "groupId": "LIS-c5a79191-test_0-S3-G2",
  "questionNumber": 28,
  "questionType": "NOTE_COMPLETION",
  "inputType": "INLINE_BLANK",
  "prompt": "28. Why must your notes be easy to read? [INLINE_INPUT_28]",
  "options": [],
  "sharedInstruction": "Questions 26-29Answer the following questions. WriteNO MORE THAN THREE WORDSfor each answer.",
  "sharedContent": "<p>26. Where should you sit when you attend a lecture? <input name=\"fname\" type=\"text\"/><br/>27. What should you do if you miss an important point? <input name=\"fname\" type=\"text\"/><br/>28. Why must your notes be easy to read? <input name=\"fname\" type=\"text\"/><br/>29. What do we call expressions which indicate what is coming next? <input name=\"fname\" type=\"text\"/></p>",
  "correctAnswer": "it saves time",
  "audioId": "c3299e8a699d",
  "audioPath": "assets/c3299e8a699d.mp3",
  "tableData": null,
  "sourceEvidence": {
    "sourceFile": "/Users/arunyagoojar/Downloads/ielts-website/ielts-listening-test-114/index.html",
    "sourceHash": "c5a791918ace9a3d010926d7ccdbbfd21e95f797ff74acf52574d16de5515d62"
  },
  "status": "VERIFIED"
}