{
  "id": "LIS-a77f9067-test_0-S2-Q17",
  "module": "LISTENING",
  "testId": "LIS-a77f9067-test_0",
  "testType": "ACADEMIC",
  "sectionId": "LIS-a77f9067-test_0-S2",
  "sectionNumber": 2,
  "passageId": null,
  "passageNumber": null,
  "groupId": "LIS-a77f9067-test_0-S2-G1",
  "questionNumber": 17,
  "questionType": "MULTIPLE_CHOICE_SINGLE",
  "inputType": "SINGLE_SELECT",
  "prompt": "11. The main purpose of the service is toAeducate peopleBpersuade people to flyCprovide people with comfort   12. The number of people working at Sydney Airport isA200B360C440   13. Dogs are chosen according toAtheir ability to stay calmBtheir friendlinessCtheir skill at locating narcotics   14. The number of postal items processed last year amounted toA4,400B52,000C72,000   15. People carrying items that are not allowedAwill get arrestedBwill be refused on boardCwill be given a warning   16. Which of the following is NOT allowed to be taken on the flight?Acarry-on itemsBplant seedsCparcels   17. What is the proper security protocol for a pocket knife found in a carry-on suitcase?Ait is returned to the passenger after examinationBit is thrown away in a safe receptacleCit is passed on to higher level authorities",
  "options": [
    "A educate people B persuade people to fly C provide people with comfort",
    "A 200 B 360 C 440",
    "A their ability to stay calm B their friendliness C their skill at locating narcotics",
    "A 4,400 B 52,000 C 72,000",
    "A will get arrested B will be refused on board C will be given a warning",
    "A carry-on items B plant seeds C parcels",
    "A it is returned to the passenger after examination B it is thrown away in a safe receptacle C it is passed on to higher level authorities"
  ],
  "sharedInstruction": "Part 2: Questions 11-17Choose the correct letter A, B or C.",
  "sharedContent": "<p></p><p></p><p class=\"wp-block-paragraph\">11. The main purpose of the service is to<br/><strong><input type=\"checkbox\"/> A</strong> educate people<br/><strong><input type=\"checkbox\"/> B</strong> persuade people to fly<br/><strong><input type=\"checkbox\"/> C</strong> provide people with comfort</p><p></p><p></p><p class=\"wp-block-paragraph\">12. The number of people working at Sydney Airport is<br/><strong><input type=\"checkbox\"/> A</strong> 200<br/><strong><input type=\"checkbox\"/> B</strong> 360<br/><strong><input type=\"checkbox\"/> C</strong> 440</p><p></p><p></p><p class=\"wp-block-paragraph\">13. Dogs are chosen according to<br/><strong><input type=\"checkbox\"/> A</strong> their ability to stay calm<br/><strong><input type=\"checkbox\"/> B</strong> their friendliness<br/><strong><input type=\"checkbox\"/> C</strong> their skill at locating narcotics</p><p></p><p></p><p class=\"wp-block-paragraph\">14. The number of postal items processed last year amounted to<br/><strong><input type=\"checkbox\"/> A</strong> 4,400<br/><strong><input type=\"checkbox\"/> B</strong> 52,000<br/><strong><input type=\"checkbox\"/> C</strong> 72,000</p><p></p><p></p><p class=\"wp-block-paragraph\">15. People carrying items that are not allowed<br/><strong><input type=\"checkbox\"/> A</strong> will get arrested<br/><strong><input type=\"checkbox\"/> B</strong> will be refused on board<br/><strong><input type=\"checkbox\"/> C</strong> will be given a warning</p><p></p><p></p><p class=\"wp-block-paragraph\">16. Which of the following is NOT allowed to be taken on the flight?<br/><strong><input type=\"checkbox\"/> A</strong> carry-on items<br/><strong><input type=\"checkbox\"/> B</strong> plant seeds<br/><strong><input type=\"checkbox\"/> C</strong> parcels</p><p></p><p></p><p class=\"wp-block-paragraph\">17. What is the proper security protocol for a pocket knife found in a carry-on suitcase?<br/><strong><input type=\"checkbox\"/> A</strong> it is returned to the passenger after examination<br/><strong><input type=\"checkbox\"/> B</strong> it is thrown away in a safe receptacle<br/><strong><input type=\"checkbox\"/> C</strong> it is passed on to higher level authorities</p><p></p><p></p>",
  "correctAnswer": "B",
  "audioId": "70720575ebef",
  "audioPath": "assets/70720575ebef.mp3",
  "tableData": null,
  "sourceEvidence": {
    "sourceFile": "/Users/arunyagoojar/Downloads/ielts-website/ielts-listening-test-71/index.html",
    "sourceHash": "a77f9067da87bcc1782181819e4ed10eee8e540110e1ae6a1b92304e044725cd"
  },
  "status": "VERIFIED"
}