{
  "id": "LIS-79acf590-test_0-S4-Q36",
  "module": "LISTENING",
  "testId": "LIS-79acf590-test_0",
  "testType": "ACADEMIC",
  "sectionId": "LIS-79acf590-test_0-S4",
  "sectionNumber": 4,
  "passageId": null,
  "passageNumber": null,
  "groupId": "LIS-79acf590-test_0-S4-G3",
  "questionNumber": 36,
  "questionType": "FORM_COMPLETION",
  "inputType": "INLINE_BLANK",
  "prompt": "• Usually awarded for [INLINE_INPUT_36]",
  "options": [],
  "sharedInstruction": "Questions 36-38Complete the following information about Foreign Office Scholarships usingNO MORE THAN THREE WORDS AND/ OR A NUMBERfor each answer.",
  "sharedContent": "<p><strong>Foreign Office Scholarships</strong><br/>• Awarded jointly by the Foreign Office and HE Institutions<br/>• Usually awarded for <strong>(36)</strong> <input name=\"fname\" type=\"text\"/><br/>• Not employed by government or <strong>(37)</strong> <input name=\"fname\" type=\"text\"/><br/>• Course must be in field of <strong>(38)</strong> <input name=\"fname\" type=\"text\"/></p>",
  "correctAnswer": "taught postgraduate courses",
  "audioId": "2e267040773d",
  "audioPath": "assets/2e267040773d.mp3",
  "tableData": null,
  "sourceEvidence": {
    "sourceFile": "/Users/arunyagoojar/Downloads/ielts-website/ielts-listening-test-35/index.html",
    "sourceHash": "79acf59077e4f9888746edd8434d1b9f9929ffc82e8a4e97e3b141abc75ca4a9"
  },
  "status": "VERIFIED"
}