{
  "id": "LIS-4efc119b-test_0-S1-Q03",
  "module": "LISTENING",
  "testId": "LIS-4efc119b-test_0",
  "testType": "ACADEMIC",
  "sectionId": "LIS-4efc119b-test_0-S1",
  "sectionNumber": 1,
  "passageId": null,
  "passageNumber": null,
  "groupId": "LIS-4efc119b-test_0-S1-G1",
  "questionNumber": 3,
  "questionType": "TABLE_COMPLETION",
  "inputType": "INLINE_BLANK",
  "prompt": "including [INLINE_INPUT_3]",
  "options": [],
  "sharedInstruction": "Part 1: Questions 1-6Complete the table below. WriteONE WORD AND/ OR A NUMBERfor each answer.",
  "sharedContent": "<p style=\"text-align: center;\"><strong><span style=\"color: #000000;\">Oyster Bay Sailing Club Courses</span></strong></p><table style=\"width: 100%; border-collapse: collapse; border-style: solid; border-color: #000000;\"><tbody><tr><td style=\"width: 19.973%; border-style: solid; border-color: #000000;\" width=\"148\"><span style=\"color: #000000;\"><strong>Name of course</strong></span></td><td style=\"width: 19.973%; border-style: solid; border-color: #000000;\" width=\"148\"><span style=\"color: #000000;\"><strong>What you learn</strong></span></td><td style=\"width: 19.973%; border-style: solid; border-color: #000000;\" width=\"148\"><span style=\"color: #000000;\"><strong>Cost</strong></span></td><td style=\"width: 19.973%; border-style: solid; border-color: #000000;\" width=\"148\"><span style=\"color: #000000;\"><strong>Other information</strong></span></td></tr><tr><td style=\"width: 19.973%; border-style: solid; border-color: #000000;\" width=\"148\"><span style=\"color: #000000;\">Taster day</span></td><td style=\"width: 19.973%; border-style: solid; border-color: #000000;\" width=\"148\"><span style=\"color: #000000;\">introduction to sailing</span></td><td style=\"width: 19.973%; border-style: solid; border-color: #000000;\" width=\"148\"><span style=\"color: #000000;\">£120 if booking one place</span></td><td style=\"width: 19.973%; border-style: solid; border-color: #000000;\" width=\"148\"><span style=\"color: #000000;\">small groups (max</span><p><span style=\"color: #000000;\">(1) <input name=\"fname\" type=\"text\"/></span></p><p><span style=\"color: #000000;\">people)</span></p></td></tr><tr><td style=\"width: 19.973%; border-style: solid; border-color: #000000;\" width=\"148\"><span style=\"color: #000000;\">Level 1</span></td><td style=\"width: 19.973%; border-style: solid; border-color: #000000;\" width=\"148\"><span style=\"color: #000000;\">basic theory e.g. understanding the</span><p><span style=\"color: #000000;\">(2)<input name=\"fname\" type=\"text\"/> and tides</span></p><p><span style=\"color: #000000;\">basic sailing skills</span></p><p><span style=\"color: #000000;\">including (3) <input name=\"fname\" type=\"text\"/></span></p><p><span style=\"color: #000000;\">information</span></p></td><td style=\"width: 19.973%; border-style: solid; border-color: #000000;\" width=\"148\"><span style=\"color: #000000;\">£200</span><p><span style=\"color: #000000;\">(4)<input name=\"fname\" type=\"text\"/> available</span></p><p><span style=\"color: #000000;\">for club members</span></p><p><span style=\"color: #000000;\">all inclusive (plus a useful (5) <input name=\"fname\" type=\"text\"/> )</span></p></td><td style=\"width: 19.973%; border-style: solid; border-color: #000000;\" width=\"148\"><span style=\"color: #000000;\">a (6)<input name=\"fname\" type=\"text\"/> at</span><p><span style=\"color: #000000;\">the end of the course for all participants</span></p></td></tr></tbody></table>",
  "correctAnswer": "UNKNOWN",
  "audioId": "0e678b5eff9d",
  "audioPath": "assets/0e678b5eff9d.mp3",
  "tableData": {
    "title": "",
    "headers": [],
    "rows": [
      [
        "Name of course",
        "What you learn",
        "Cost",
        "Other information"
      ],
      [
        "Taster day",
        "introduction to sailing",
        "£120 if booking one place",
        "small groups (max (1) people)"
      ],
      [
        "Level 1",
        "basic theory e.g. understanding the (2) and tides basic sailing skills including (3) information",
        "£200 (4) available for club members all inclusive (plus a useful (5) )",
        "a (6) at the end of the course for all participants"
      ]
    ]
  },
  "sourceEvidence": {
    "sourceFile": "/Users/arunyagoojar/Downloads/ielts-website/ielts-listening-test-205/index.html",
    "sourceHash": "4efc119b762f4aa88288c1e7db02cdaee791b47432db965d7f10d531a7d151cb"
  },
  "status": "VERIFIED"
}