{
  "id": "LIS-beb0bf80-test_0-S4-Q35",
  "module": "LISTENING",
  "testId": "LIS-beb0bf80-test_0",
  "testType": "ACADEMIC",
  "sectionId": "LIS-beb0bf80-test_0-S4",
  "sectionNumber": 4,
  "passageId": null,
  "passageNumber": null,
  "groupId": "LIS-beb0bf80-test_0-S4-G2",
  "questionNumber": 35,
  "questionType": "MATCHING",
  "inputType": "TEXT_OR_SELECT",
  "prompt": "35. A lack of important signage [BLANK]",
  "options": [],
  "sharedInstruction": "Questions 34-37Match the groups A-D with their concerns about shared space 34-37.",
  "sharedContent": "<p><strong>A</strong> Motorists<br/><strong>B</strong> Blind people<br/><strong>C</strong> Cyclists<br/><strong>D</strong> Supporters of shared space</p><p>34. Insufficient experience amongst planners <input name=\"fname\" type=\"text\"/><br/>35. A lack of important signage <input name=\"fname\" type=\"text\"/><br/>36. Intimidation by motorists <input name=\"fname\" type=\"text\"/><br/>37. The loss of familiar street furniture <input name=\"fname\" type=\"text\"/></p>",
  "correctAnswer": "A",
  "audioId": "4d567c7da693",
  "audioPath": "assets/4d567c7da693.mp3",
  "tableData": null,
  "sourceEvidence": {
    "sourceFile": "/Users/arunyagoojar/Downloads/ielts-website/ielts-listening-test-104/index.html",
    "sourceHash": "beb0bf8005c10118c70e21e5b952255dcb130c4a99a692e6b06212ceba48b16e"
  },
  "status": "VERIFIED"
}