{
  "id": "LIS-0bc2cbd5-test_0-S4-Q34",
  "module": "LISTENING",
  "testId": "LIS-0bc2cbd5-test_0",
  "testType": "ACADEMIC",
  "sectionId": "LIS-0bc2cbd5-test_0-S4",
  "sectionNumber": 4,
  "passageId": null,
  "passageNumber": null,
  "groupId": "LIS-0bc2cbd5-test_0-S4-G1",
  "questionNumber": 34,
  "questionType": "NOTE_COMPLETION",
  "inputType": "INLINE_BLANK",
  "prompt": "• searching plants in the rainforest to experiment [INLINE_INPUT_34]",
  "options": [],
  "sharedInstruction": "Part 4: Questions 31-40Complete the notes below. WriteNO MORE THAN TWO WORDSfor each answer.",
  "sharedContent": "<p><strong>ROBERTS COMPANY</strong><br/><strong>Founding</strong><br/>• The most important principal of the company is to improve the <strong>(31)</strong> <input name=\"fname\" type=\"text\"/> development of camera technology.</p><p><strong>Aim</strong><br/>• It was founded by Dwayne Roberts in 1957 and mainly explore <strong>(32)</strong> <input name=\"fname\" type=\"text\"/></p><p><strong>Potential applications</strong><br/>• recording high-definition video<br/>• discovering <strong>(33)</strong> <input name=\"fname\" type=\"text\"/><br/>• searching plants in the rainforest to experiment <strong>(34)</strong> <input name=\"fname\" type=\"text\"/><br/>• distributing more across the road network to control <strong>(35)</strong> <input name=\"fname\" type=\"text\"/></p><p><strong>At present</strong><br/>• <strong>(36)</strong> <input name=\"fname\" type=\"text\"/> are the best sellers in the company.<br/>• They are designed to look like <strong>(37)</strong> <input name=\"fname\" type=\"text\"/><br/>• The company is working on a tiny <strong>(38)</strong> <input name=\"fname\" type=\"text\"/> to change the way people see photography.</p><p><strong>Other applications</strong><br/>• Surgeries could be faster and more <strong>(39)</strong> <input name=\"fname\" type=\"text\"/></p><p><strong>Internship opportunity</strong><br/>• To get it, the students can participate in the <strong>(40)</strong> <input name=\"fname\" type=\"text\"/> organised by the company every year.</p><p><br/></p><input bg_collapse_expand=\"6abdce0a512798023821389\" type=\"hidden\" value=\"6abdce0a512798023821389\"/><input id=\"bg-show-more-text-6abdce0a512798023821389\" type=\"hidden\" value=\"Show Answers\"/><input id=\"bg-show-less-text-6abdce0a512798023821389\" type=\"hidden\" value=\"Hide Answers\"/>",
  "correctAnswer": "future medicine",
  "audioId": "36b8ac2671d1",
  "audioPath": "assets/36b8ac2671d1.mp3",
  "tableData": null,
  "sourceEvidence": {
    "sourceFile": "/Users/arunyagoojar/Downloads/ielts-website/ielts-listening-test-63/index.html",
    "sourceHash": "0bc2cbd57c7543fc6539c1b21628e2f9daa8cd7264973673613b846649b8b70a"
  },
  "status": "VERIFIED"
}