{
  "id": "LIS-686720df-test_0-S4-Q39",
  "module": "LISTENING",
  "testId": "LIS-686720df-test_0",
  "testType": "ACADEMIC",
  "sectionId": "LIS-686720df-test_0-S4",
  "sectionNumber": 4,
  "passageId": null,
  "passageNumber": null,
  "groupId": "LIS-686720df-test_0-S4-G1",
  "questionNumber": 39,
  "questionType": "NOTE_COMPLETION",
  "inputType": "INLINE_BLANK",
  "prompt": "• changes influenced by [INLINE_INPUT_39] taking senior roles",
  "options": [],
  "sharedInstruction": "Part 4: Questions 31-40Complete the notes below. WriteONE WORD ONLY.",
  "sharedContent": "<p class=\"wp-block-paragraph\"><strong>THE FUTURE OF MANAGEMENT</strong><br/>Business markets<br/>• greater <strong>(31)</strong> <input name=\"fname\" type=\"text\"/> among companies<br/>• increase in power of large <strong>(32)</strong> <input name=\"fname\" type=\"text\"/> companies<br/>• rising <strong>(33)</strong> <input name=\"fname\" type=\"text\"/> in certain countries</p><p class=\"wp-block-paragraph\"><strong>External influences on businesses</strong><br/>• more discussion with <strong>(34)</strong> <input name=\"fname\" type=\"text\"/> before making business decisions<br/>• environmental concerns which may lead to more <strong>(35)</strong> <input name=\"fname\" type=\"text\"/></p><p class=\"wp-block-paragraph\"><strong>Business structures</strong><br/>• more teams will be formed to work on a particular <strong>(36)</strong> <input name=\"fname\" type=\"text\"/><br/>• businesses may need to offer hours that are <strong>(37)</strong> <input name=\"fname\" type=\"text\"/> , or the chance to work remotely</p><p class=\"wp-block-paragraph\"><strong>Management styles</strong><br/>• increasing need for managers to provide good <strong>(38)</strong> <input name=\"fname\" type=\"text\"/><br/>• changes influenced by <strong>(39)</strong> <input name=\"fname\" type=\"text\"/> taking senior roles</p><p class=\"wp-block-paragraph\"><strong>Changes in the economy</strong><br/>• service sector continues to be important<br/>• increasing value of intellectual property<br/>• more and more <strong>(40)</strong> <input name=\"fname\" type=\"text\"/> workers<br/><br/><br/></p><input bg_collapse_expand=\"6abc57f67667d3063535736\" type=\"hidden\" value=\"6abc57f67667d3063535736\"/><input id=\"bg-show-more-text-6abc57f67667d3063535736\" type=\"hidden\" value=\"Show Answers\"/><input id=\"bg-show-less-text-6abc57f67667d3063535736\" type=\"hidden\" value=\"Hide Answers\"/>",
  "correctAnswer": "women",
  "audioId": "39474f39ccb9",
  "audioPath": "assets/39474f39ccb9.mp3",
  "tableData": null,
  "sourceEvidence": {
    "sourceFile": "/Users/arunyagoojar/Downloads/ielts-website/ielts-listening-test-142/index.html",
    "sourceHash": "686720df436ae2d10aa9b45f1e1fdb5e8375a403ac965b362c0aa12f3b5600ed"
  },
  "status": "VERIFIED"
}