{
  "id": "LIS-eeeb2237-test_0-S2-Q19",
  "module": "LISTENING",
  "testId": "LIS-eeeb2237-test_0",
  "testType": "ACADEMIC",
  "sectionId": "LIS-eeeb2237-test_0-S2",
  "sectionNumber": 2,
  "passageId": null,
  "passageNumber": null,
  "groupId": "LIS-eeeb2237-test_0-S2-G2",
  "questionNumber": 19,
  "questionType": "NOTE_COMPLETION",
  "inputType": "INLINE_BLANK",
  "prompt": "• Premier members can bring some [INLINE_INPUT_19] every month.",
  "options": [],
  "sharedInstruction": "Questions 13-20Complete the notes below. WriteNO MORE THAN TWO WORDSfor each answer.",
  "sharedContent": "<p class=\"wp-block-paragraph\">Joining the leisure club<br/>Personal Assessment<br/>• New members should describe any <strong>(13)</strong> <input name=\"fname\" type=\"text\"/><br/>• The <strong>(14)</strong> <input name=\"fname\" type=\"text\"/> will be explained to you before you use the equipment.<br/>• You will be given a six-week <strong>(15)</strong> <input name=\"fname\" type=\"text\"/></p><p class=\"wp-block-paragraph\">Types of membership<br/>• There is a compulsory £90 <strong>(16)</strong> <input name=\"fname\" type=\"text\"/> fee for members.<br/>• Gold members are given <strong>(17)</strong> <input name=\"fname\" type=\"text\"/> to all the LP clubs.<br/>• Premier members are given priority during <strong>(18)</strong> <input name=\"fname\" type=\"text\"/> hours.<br/>• Premier members can bring some <strong>(19)</strong> <input name=\"fname\" type=\"text\"/> every month.<br/>• Members should always take their <strong>(20)</strong> <input name=\"fname\" type=\"text\"/> with them.</p><p class=\"wp-block-paragraph\"><br/><br/></p>",
  "correctAnswer": "guests",
  "audioId": "c0c57d36a298",
  "audioPath": "assets/c0c57d36a298.mp3",
  "tableData": null,
  "sourceEvidence": {
    "sourceFile": "/Users/arunyagoojar/Downloads/ielts-website/ielts-listening-test-141/index.html",
    "sourceHash": "eeeb223798cf70c03a66973c88e5c39e302a4808f856131c473d1afae5c0416e"
  },
  "status": "VERIFIED"
}