{
  "id": "LIS-d34941a8-test_0-S3-Q29",
  "module": "LISTENING",
  "testId": "LIS-d34941a8-test_0",
  "testType": "ACADEMIC",
  "sectionId": "LIS-d34941a8-test_0-S3",
  "sectionNumber": 3,
  "passageId": null,
  "passageNumber": null,
  "groupId": "LIS-d34941a8-test_0-S3-G2",
  "questionNumber": 29,
  "questionType": "MATCHING",
  "inputType": "TEXT_OR_SELECT",
  "prompt": "29. Northern right whale [BLANK]",
  "options": [],
  "sharedInstruction": "Questions 28-30Match the following types of whales with the pictures given according to different feature descriptions.",
  "sharedContent": "<p>28. Sperm whale <input name=\"fname\" type=\"text\"/><br/>29. Northern right whale <input name=\"fname\" type=\"text\"/><br/>30. Minke whale <input name=\"fname\" type=\"text\"/></p><p><br/></p>",
  "correctAnswer": "C",
  "audioId": "337da41aeb2b",
  "audioPath": "assets/337da41aeb2b.mp3",
  "tableData": null,
  "sourceEvidence": {
    "sourceFile": "/Users/arunyagoojar/Downloads/ielts-website/ielts-listening-test-111.html",
    "sourceHash": "d34941a8644d2c950ffb5c15909de32a59707ffaefdea86c9a1324f69d33f3c7"
  },
  "status": "VERIFIED"
}