{
  "id": "LIS-85a2895a-test_0-S2-Q15",
  "module": "LISTENING",
  "testId": "LIS-85a2895a-test_0",
  "testType": "ACADEMIC",
  "sectionId": "LIS-85a2895a-test_0-S2",
  "sectionNumber": 2,
  "passageId": null,
  "passageNumber": null,
  "groupId": "LIS-85a2895a-test_0-S2-G2",
  "questionNumber": 15,
  "questionType": "FORM_COMPLETION",
  "inputType": "INLINE_BLANK",
  "prompt": "Fifth Stop: [INLINE_INPUT_15]",
  "options": [],
  "sharedInstruction": "Questions 13-15Complete the information below. WriteNO MORE THAN TWO WORDS.",
  "sharedContent": "<p class=\"wp-block-paragraph\">Starting point: Tour Bus Office<br/>First stop: <strong>(13)</strong> <input name=\"fname\" type=\"text\"/><br/>Second stop: Fishing Docks<br/>Third Stop: <strong>(14)</strong> <input name=\"fname\" type=\"text\"/><br/>Fourth Stop: Shopping District<br/>Fifth Stop: <strong>(15)</strong> <input name=\"fname\" type=\"text\"/></p><figure><table><tbody><tr><td data-align=\"center\"><strong>Place</strong></td><td data-align=\"center\"><strong>Activity</strong></td></tr><tr><td data-align=\"center\">First stop</td><td data-align=\"center\">Enjoy the (16)………………………..of the bay</td></tr><tr><td data-align=\"center\">Second stop</td><td data-align=\"center\">Look at the (17)…………………………</td></tr><tr><td data-align=\"center\">Third stop</td><td data-align=\"center\">(18)……………………fish</td></tr><tr><td data-align=\"center\">Fourth stop</td><td data-align=\"center\">Purchase (19)………………</td></tr><tr><td data-align=\"center\">Fifth stop</td><td data-align=\"center\">Visit the (20)……………………..</td></tr></tbody></table></figure>",
  "correctAnswer": "green street",
  "audioId": "c915bf885122",
  "audioPath": "assets/c915bf885122.mp3",
  "tableData": {
    "title": "",
    "headers": [],
    "rows": [
      [
        "Place",
        "Activity"
      ],
      [
        "First stop",
        "Enjoy the (16)………………………..of the bay"
      ],
      [
        "Second stop",
        "Look at the (17)…………………………"
      ],
      [
        "Third stop",
        "(18)……………………fish"
      ],
      [
        "Fourth stop",
        "Purchase (19)………………"
      ],
      [
        "Fifth stop",
        "Visit the (20)…………………….."
      ]
    ]
  },
  "sourceEvidence": {
    "sourceFile": "/Users/arunyagoojar/Downloads/ielts-website/ielts-listening-test-10/index.html",
    "sourceHash": "85a2895acaea3852b0dd9b855b6be30bd2de639abdaea3b250c8c7acfc8c9406"
  },
  "status": "VERIFIED"
}