{
  "id": "LIS-7ebb610f-test_0-S4-Q38",
  "module": "LISTENING",
  "testId": "LIS-7ebb610f-test_0",
  "testType": "ACADEMIC",
  "sectionId": "LIS-7ebb610f-test_0-S4",
  "sectionNumber": 4,
  "passageId": null,
  "passageNumber": null,
  "groupId": "LIS-7ebb610f-test_0-S4-G2",
  "questionNumber": 38,
  "questionType": "SENTENCE_COMPLETION",
  "inputType": "INLINE_BLANK",
  "prompt": "[INLINE_INPUT_38]",
  "options": [],
  "sharedInstruction": "Questions 33-39Complete the sentences below. WriteNO MORE THAN THREE WORDSfor each answer.",
  "sharedContent": "<p></p><p></p><p class=\"wp-block-paragraph\">33. Sterilisation is usually performed only on <input name=\"fname\" type=\"text\"/></p><p></p><p></p><p class=\"wp-block-paragraph\">34. Sterilisation is carried out in <input name=\"fname\" type=\"text\"/></p><p></p><p></p><p class=\"wp-block-paragraph\">35. Cats remain there for <input name=\"fname\" type=\"text\"/></p><p></p><p></p><p class=\"wp-block-paragraph\">36. To show that an animal has been sterilized, one <input name=\"fname\" type=\"text\"/></p><p></p><p></p><figure><table><thead><tr><th>Method</th><th>Message</th><th>When</th></tr></thead><tbody><tr><td>Poster campaign</td><td>A kitten is not (37)…………….</td><td>now</td></tr><tr><td>(38)………………….</td><td>Families may get bored with the responsibility of owning a pet</td><td>perhaps before next Christmas</td></tr><tr><td>Newspaper advertisements</td><td>Abandoned animals cause problems for other people</td><td>(39)………………….</td></tr></tbody></table></figure><p></p><p></p><p class=\"wp-block-paragraph\"><strong>(37)</strong> <input name=\"fname\" type=\"text\"/><br/><strong>(38)</strong> <input name=\"fname\" type=\"text\"/><br/><strong>(39)</strong> <input name=\"fname\" type=\"text\"/></p><p></p><p></p>",
  "correctAnswer": "radio ads",
  "audioId": "4605e8992e0a",
  "audioPath": "assets/4605e8992e0a.mp3",
  "tableData": {
    "title": "",
    "headers": [
      "Method",
      "Message",
      "When"
    ],
    "rows": [
      [
        "Poster campaign",
        "A kitten is not (37)…………….",
        "now"
      ],
      [
        "(38)………………….",
        "Families may get bored with the responsibility of owning a pet",
        "perhaps before next Christmas"
      ],
      [
        "Newspaper advertisements",
        "Abandoned animals cause problems for other people",
        "(39)…………………."
      ]
    ]
  },
  "sourceEvidence": {
    "sourceFile": "/Users/arunyagoojar/Downloads/ielts-website/ielts-listening-test-50/index.html",
    "sourceHash": "7ebb610f4d17546bc28a2aa4fbbc43a57ae4248719b89258a7b95b2f91deb07c"
  },
  "status": "VERIFIED"
}