{
  "id": "LIS-bed47a38-test_0-S1-Q01",
  "module": "LISTENING",
  "testId": "LIS-bed47a38-test_0",
  "testType": "ACADEMIC",
  "sectionId": "LIS-bed47a38-test_0-S1",
  "sectionNumber": 1,
  "passageId": null,
  "passageNumber": null,
  "groupId": "LIS-bed47a38-test_0-S1-G1",
  "questionNumber": 1,
  "questionType": "FORM_COMPLETION",
  "inputType": "INLINE_BLANK",
  "prompt": "Customer name: Mr. [INLINE_INPUT_1]",
  "options": [],
  "sharedInstruction": "Part 1:Questions 1-8Complete the form below. WriteNO MORE THAN THREE WORDS OR A NUMBERfor each answer.",
  "sharedContent": "<p><strong>Five Star Caterers – Customer Booking Form</strong></p><p>Event: Party</p><p>Customer name: Mr. <strong>(1)</strong> <input name=\"fname\" type=\"text\"/><br/>Daytime telephone number: <strong>(2)</strong> <input name=\"fname\" type=\"text\"/><br/>Telephone number after 5 pm: As above (if no one answers, <strong>(3)</strong> <input name=\"fname\" type=\"text\"/> )<br/>Number of guests: <strong>(4)</strong> <input name=\"fname\" type=\"text\"/><br/>Date: <strong>(5)</strong> <input name=\"fname\" type=\"text\"/></p><p>Seating<br/>Shape: <strong>(6)</strong> <input name=\"fname\" type=\"text\"/><br/>Size: <strong>(7)</strong> <input name=\"fname\" type=\"text\"/><br/>Number of tables: <strong>(8)</strong> <input name=\"fname\" type=\"text\"/></p>",
  "correctAnswer": "Sanders",
  "audioId": "651ac133821d",
  "audioPath": "assets/651ac133821d.mp3",
  "tableData": null,
  "sourceEvidence": {
    "sourceFile": "/Users/arunyagoojar/Downloads/ielts-website/ielts-listening-test-138/index.html",
    "sourceHash": "bed47a386ce1a8197ad15c53fda1eb59c9d941f78c21277b75a804ac024702ed"
  },
  "status": "VERIFIED"
}