{
  "id": "LIS-c636f997-test_0-S3-Q21",
  "module": "LISTENING",
  "testId": "LIS-c636f997-test_0",
  "testType": "ACADEMIC",
  "sectionId": "LIS-c636f997-test_0-S3",
  "sectionNumber": 3,
  "passageId": null,
  "passageNumber": null,
  "groupId": "LIS-c636f997-test_0-S3-G1",
  "questionNumber": 21,
  "questionType": "MULTIPLE_CHOICE_SINGLE",
  "inputType": "SINGLE_SELECT",
  "prompt": "Honey Bees in Australia21. Where in Australia have Asian honey bees been found in the past?AQueenslandBNew South WalesCseveral states 22. A problem with Asian honey bees is that theyAattack native beesBcarry parasitesCdamage crops 23. What point is made about Australian bees?ATheir honey varies in qualityBTheir size stops them from pollinating some flowersCThey are sold to customers abroad 24. Grant Freeman says that if Asian honey bees got into Australia,Athe country’s economy would be affectedBthey could be used in the study of allergiesCcertain areas of agriculture would benefit",
  "options": [
    "A Queensland B New South Wales C several states",
    "A problem with Asian honey bees is that they A attack native bees B carry parasites C damage crops",
    "A Their honey varies in quality B Their size stops them from pollinating some flowers C They are sold to customers abroad",
    "A the country’s economy would be affected B they could be used in the study of allergies C certain areas of agriculture would benefit"
  ],
  "sharedInstruction": "Part 3: Questions 21-24Choose the correct letter A, B or C.",
  "sharedContent": "<p class=\"wp-block-paragraph\">Honey Bees in Australia<br/>21. Where in Australia have Asian honey bees been found in the past?<br/><strong><input type=\"checkbox\"/> A</strong> Queensland<br/><strong><input type=\"checkbox\"/> B</strong> New South Wales<br/><strong><input type=\"checkbox\"/> C</strong> several states</p><p class=\"wp-block-paragraph\">22. A problem with Asian honey bees is that they<br/><strong><input type=\"checkbox\"/> A</strong> attack native bees<br/><strong><input type=\"checkbox\"/> B</strong> carry parasites<br/><strong><input type=\"checkbox\"/> C</strong> damage crops</p><p class=\"wp-block-paragraph\">23. What point is made about Australian bees?<br/><strong><input type=\"checkbox\"/> A</strong> Their honey varies in quality<br/><strong><input type=\"checkbox\"/> B</strong> Their size stops them from pollinating some flowers<br/><strong><input type=\"checkbox\"/> C</strong> They are sold to customers abroad</p><p class=\"wp-block-paragraph\">24. Grant Freeman says that if Asian honey bees got into Australia,<br/><strong><input type=\"checkbox\"/> A</strong> the country’s economy would be affected<br/><strong><input type=\"checkbox\"/> B</strong> they could be used in the study of allergies<br/><strong><input type=\"checkbox\"/> C</strong> certain areas of agriculture would benefit</p>",
  "correctAnswer": "A",
  "audioId": "127171fafed5",
  "audioPath": "assets/127171fafed5.mp3",
  "tableData": null,
  "sourceEvidence": {
    "sourceFile": "/Users/arunyagoojar/Downloads/ielts-website/listening-150/index.html",
    "sourceHash": "c636f997ceef0f9fc7a6fdfc4ffc1acc2b9bd1ddb1de95911f3a3dbe9eebd274"
  },
  "status": "VERIFIED"
}