{
  "id": "LIS-7ebb610f-test_0-S3-Q29",
  "module": "LISTENING",
  "testId": "LIS-7ebb610f-test_0",
  "testType": "ACADEMIC",
  "sectionId": "LIS-7ebb610f-test_0-S3",
  "sectionNumber": 3,
  "passageId": null,
  "passageNumber": null,
  "groupId": "LIS-7ebb610f-test_0-S3-G2",
  "questionNumber": 29,
  "questionType": "NOTE_COMPLETION",
  "inputType": "INLINE_BLANK",
  "prompt": "29. the conclusion [INLINE_INPUT_29]",
  "options": [],
  "sharedInstruction": "Questions 26-30",
  "sharedContent": "<p></p><p></p><p class=\"wp-block-paragraph\">What suggestions does the tutor make?</p><p></p><p></p><p class=\"wp-block-paragraph\">Complete the list below with the correct letters A, B or C.</p><p></p><p></p><p class=\"wp-block-paragraph\">26. the introduction <input name=\"fname\" type=\"text\"/><br/>27. information on the railways <input name=\"fname\" type=\"text\"/><br/>28. the quotation from The Times <input name=\"fname\" type=\"text\"/><br/>29. the conclusion <input name=\"fname\" type=\"text\"/><br/>30. the bibliography <input name=\"fname\" type=\"text\"/></p><p></p><p></p><p class=\"wp-block-paragraph\"><strong>A</strong> Expand it<br/><strong>B</strong> Reduce it<br/><strong>C</strong> Delete it</p><p></p><p></p><p class=\"wp-block-paragraph\"><br/><br/></p><p></p><p></p>",
  "correctAnswer": "A",
  "audioId": "4605e8992e0a",
  "audioPath": "assets/4605e8992e0a.mp3",
  "tableData": null,
  "sourceEvidence": {
    "sourceFile": "/Users/arunyagoojar/Downloads/ielts-website/ielts-listening-test-50/index.html",
    "sourceHash": "7ebb610f4d17546bc28a2aa4fbbc43a57ae4248719b89258a7b95b2f91deb07c"
  },
  "status": "VERIFIED"
}