{
  "id": "LIS-acc3e632-test_0-S2-Q20",
  "module": "LISTENING",
  "testId": "LIS-acc3e632-test_0",
  "testType": "ACADEMIC",
  "sectionId": "LIS-acc3e632-test_0-S2",
  "sectionNumber": 2,
  "passageId": null,
  "passageNumber": null,
  "groupId": "LIS-acc3e632-test_0-S2-G3",
  "questionNumber": 20,
  "questionType": "MULTIPLE_CHOICE_MULTI",
  "inputType": "MULTI_SELECT",
  "prompt": "WhichTWOactivities can students do after the tour at present?Abuild model dinosaursBwatch filmsCdraw dinosaursDfind dinosaur eggsEplay computer games",
  "options": [
    "A build model dinosaurs",
    "B watch films",
    "C draw dinosaurs",
    "D find dinosaur eggs",
    "E play computer games"
  ],
  "sharedInstruction": "Questions 19 and 20ChooseTWOletters A-E.",
  "sharedContent": "<p>Which <strong>TWO</strong> activities can students do after the tour at present?<br/><strong><input type=\"checkbox\"/> A</strong> build model dinosaurs<br/><strong><input type=\"checkbox\"/> B</strong> watch films<br/><strong><input type=\"checkbox\"/> C</strong> draw dinosaurs<br/><strong><input type=\"checkbox\"/> D</strong> find dinosaur eggs<br/><strong><input type=\"checkbox\"/> E</strong> play computer games</p><p><br/></p>",
  "correctAnswer": "E",
  "audioId": "b624d26953e4",
  "audioPath": "assets/b624d26953e4.mp3",
  "tableData": null,
  "sourceEvidence": {
    "sourceFile": "/Users/arunyagoojar/Downloads/ielts-website/ielts-listening-test-149/index.html",
    "sourceHash": "acc3e63237900f8950b9b4f33ed71f53cf7a163ceae9939230f9b0d4b57bf174"
  },
  "status": "VERIFIED"
}