{
  "id": "LIS-33baad92-test_0-S4-Q39",
  "module": "LISTENING",
  "testId": "LIS-33baad92-test_0",
  "testType": "ACADEMIC",
  "sectionId": "LIS-33baad92-test_0-S4",
  "sectionNumber": 4,
  "passageId": null,
  "passageNumber": null,
  "groupId": "LIS-33baad92-test_0-S4-G2",
  "questionNumber": 39,
  "questionType": "MULTIPLE_CHOICE_SINGLE",
  "inputType": "SINGLE_SELECT",
  "prompt": "36. We are all present hedonistsAat schoolBat birthCwhile eating and drinking 37. American boys drop out of school at a higher rate than girls becauseAthey need to be in control of the way they learnBthey play video games instead of doing school workCthey are not as intelligent as girls 38. Present-orientated childrenAdo not realise present actions can have negative future effectsBare unable to learn lessons from past mistakesCknow what could happen if they do something bad, but do it anyway 39. If Americans had an extra day per week, they would spend itAworking harderBbuilding relationshipsCsharing family meals 40. Understanding how people think about time can help usAbecome more virtuousBwork together betterCidentify careless or ambitious people",
  "options": [
    "A at school B at birth C while eating and drinking",
    "A they need to be in control of the way they learn B they play video games instead of doing school work C they are not as intelligent as girls",
    "A do not realise present actions can have negative future effects B are unable to learn lessons from past mistakes C know what could happen if they do something bad, but do it anyway",
    "A working harder B building relationships C sharing family meals",
    "A become more virtuous B work together better C identify careless or ambitious people"
  ],
  "sharedInstruction": "Questions 36–40Choose the correct letter, A, B or C.",
  "sharedContent": "<p class=\"wp-block-paragraph\">36. We are all present hedonists<br/><strong><input type=\"checkbox\"/> A</strong> at school<br/><strong><input type=\"checkbox\"/> B</strong> at birth<br/><strong><input type=\"checkbox\"/> C</strong> while eating and drinking</p><p class=\"wp-block-paragraph\">37. American boys drop out of school at a higher rate than girls because<br/><strong><input type=\"checkbox\"/> A</strong> they need to be in control of the way they learn<br/><strong><input type=\"checkbox\"/> B</strong> they play video games instead of doing school work<br/><strong><input type=\"checkbox\"/> C</strong> they are not as intelligent as girls</p><p class=\"wp-block-paragraph\">38. Present-orientated children<br/><strong><input type=\"checkbox\"/> A</strong> do not realise present actions can have negative future effects<br/><strong><input type=\"checkbox\"/> B</strong> are unable to learn lessons from past mistakes<br/><strong><input type=\"checkbox\"/> C</strong> know what could happen if they do something bad, but do it anyway</p><p class=\"wp-block-paragraph\">39. If Americans had an extra day per week, they would spend it<br/><strong><input type=\"checkbox\"/> A</strong> working harder<br/><strong><input type=\"checkbox\"/> B</strong> building relationships<br/><strong><input type=\"checkbox\"/> C</strong> sharing family meals</p><p class=\"wp-block-paragraph\">40. Understanding how people think about time can help us<br/><strong><input type=\"checkbox\"/> A</strong> become more virtuous<br/><strong><input type=\"checkbox\"/> B</strong> work together better<br/><strong><input type=\"checkbox\"/> C</strong> identify careless or ambitious people<br/><br/><br/></p><input bg_collapse_expand=\"6abc37b9052367086370785\" type=\"hidden\" value=\"6abc37b9052367086370785\"/><input id=\"bg-show-more-text-6abc37b9052367086370785\" type=\"hidden\" value=\"Show Answers\"/><input id=\"bg-show-less-text-6abc37b9052367086370785\" type=\"hidden\" value=\"Hide Answers\"/>",
  "correctAnswer": "A",
  "audioId": "4b505f2516ff",
  "audioPath": "assets/4b505f2516ff.mp3",
  "tableData": null,
  "sourceEvidence": {
    "sourceFile": "/Users/arunyagoojar/Downloads/ielts-website/ielts-listening-test-110/index.html",
    "sourceHash": "33baad929292182c498b57396946c4bd990b6e101f1ecc75a1d76456fbd39dbb"
  },
  "status": "VERIFIED"
}