{
  "id": "LIS-cde58c1b-test_0-S3-Q24",
  "module": "LISTENING",
  "testId": "LIS-cde58c1b-test_0",
  "testType": "ACADEMIC",
  "sectionId": "LIS-cde58c1b-test_0-S3",
  "sectionNumber": 3,
  "passageId": null,
  "passageNumber": null,
  "groupId": "LIS-cde58c1b-test_0-S3-G1",
  "questionNumber": 24,
  "questionType": "MULTIPLE_CHOICE_SINGLE",
  "inputType": "SINGLE_SELECT",
  "prompt": "21. What kind of research method does the professor recommend?AinterviewBobservationCquestionnaire 22. What is the project based on?Aa study they did before in AustraliaBa similar angle someone has done beforeCan Australian study 23. What does the professor advise Douglas to do about the formation of the focus groups?Astrengthen the group in sizeBreduce the number of children in each groupCbuild more than 3 groups 24. To do the project best, the professor suggests the studentsAinterview various people or sectors.Bnot be too ambitious.Cwork hard enough. 25. To gather data, the professor asks JaneAto replace other people’s advice.Bto simplify the textbook.Cto practice using the date table. 26. The reason why Douglas hasn’t read enough reference books is thatAhe doesn’t have enough time.Bhe thinks there are too many books to read.Che hasn’t spent time in the library.",
  "options": [
    "A interview B observation C questionnaire",
    "A a study they did before in Australia B a similar angle someone has done before C an Australian study",
    "A strengthen the group in size B reduce the number of children in each group C build more than 3 groups",
    "A interview various people or sectors. B not be too ambitious. C work hard enough.",
    "A to replace other people’s advice. B to simplify the textbook. C to practice using the date table.",
    "A he doesn’t have enough time. B he thinks there are too many books to read. C he hasn’t spent time in the library."
  ],
  "sharedInstruction": "Part 3: Questions 21-26Choose the correct letter A, B or C.",
  "sharedContent": "<p class=\"wp-block-paragraph\">21. What kind of research method does the professor recommend?<br/><strong><input type=\"checkbox\"/> A</strong> interview<br/><strong><input type=\"checkbox\"/> B</strong> observation<br/><strong><input type=\"checkbox\"/> C</strong> questionnaire</p><p class=\"wp-block-paragraph\">22. What is the project based on?<br/><strong><input type=\"checkbox\"/> A</strong> a study they did before in Australia<br/><strong><input type=\"checkbox\"/> B</strong> a similar angle someone has done before<br/><strong><input type=\"checkbox\"/> C</strong> an Australian study</p><p class=\"wp-block-paragraph\">23. What does the professor advise Douglas to do about the formation of the focus groups?<br/><strong><input type=\"checkbox\"/> A</strong> strengthen the group in size<br/><strong><input type=\"checkbox\"/> B</strong> reduce the number of children in each group<br/><strong><input type=\"checkbox\"/> C</strong> build more than 3 groups</p><p class=\"wp-block-paragraph\">24. To do the project best, the professor suggests the students<br/><strong><input type=\"checkbox\"/> A</strong> interview various people or sectors.<br/><strong><input type=\"checkbox\"/> B</strong> not be too ambitious.<br/><strong><input type=\"checkbox\"/> C</strong> work hard enough.</p><p class=\"wp-block-paragraph\">25. To gather data, the professor asks Jane<br/><strong><input type=\"checkbox\"/> A</strong> to replace other people’s advice.<br/><strong><input type=\"checkbox\"/> B</strong> to simplify the textbook.<br/><strong><input type=\"checkbox\"/> C</strong> to practice using the date table.</p><p class=\"wp-block-paragraph\">26. The reason why Douglas hasn’t read enough reference books is that<br/><strong><input type=\"checkbox\"/> A</strong> he doesn’t have enough time.<br/><strong><input type=\"checkbox\"/> B</strong> he thinks there are too many books to read.<br/><strong><input type=\"checkbox\"/> C</strong> he hasn’t spent time in the library.</p>",
  "correctAnswer": "B",
  "audioId": "b9191d87a029",
  "audioPath": "assets/b9191d87a029.mp3",
  "tableData": null,
  "sourceEvidence": {
    "sourceFile": "/Users/arunyagoojar/Downloads/ielts-website/ielts-listening-test-103/index.html",
    "sourceHash": "cde58c1b465b4d1d762329f150a7482cec04001d86e0091aa0d3d4bde41ab877"
  },
  "status": "VERIFIED"
}