{
  "id": "LIS-f181435f-test_0-S2-Q17",
  "module": "LISTENING",
  "testId": "LIS-f181435f-test_0",
  "testType": "ACADEMIC",
  "sectionId": "LIS-f181435f-test_0-S2",
  "sectionNumber": 2,
  "passageId": null,
  "passageNumber": null,
  "groupId": "LIS-f181435f-test_0-S2-G2",
  "questionNumber": 17,
  "questionType": "MULTIPLE_CHOICE_MULTI",
  "inputType": "MULTI_SELECT",
  "prompt": "WhichTWOthings does David say about the lifeboat volunteer training? AThe residential course developed his leadership skills.BThe training in use of ropes and knots was quite brief.CThe training exercises have built up his mental strength.DThe casualty care activities were particularly challenging for him.EThe wave tank activities provided practice in survival techniques.",
  "options": [
    "A The residential course developed his leadership skills.",
    "B The training in use of ropes and knots was quite brief.",
    "C The training exercises have built up his mental strength.",
    "D The casualty care activities were particularly challenging for him.",
    "E The wave tank activities provided practice in survival techniques."
  ],
  "sharedInstruction": "Questions 17 and 18ChooseTWOletters, A-E.",
  "sharedContent": "<p>Which <strong>TWO</strong> things does David say about the lifeboat volunteer training?</p><p><input type=\"checkbox\"/><strong>A</strong> The residential course developed his leadership skills.<br/><input type=\"checkbox\"/><strong>B</strong> The training in use of ropes and knots was quite brief.<br/><input type=\"checkbox\"/><strong>C</strong> The training exercises have built up his mental strength.<br/><input type=\"checkbox\"/><strong>D</strong> The casualty care activities were particularly challenging for him.<br/><input type=\"checkbox\"/><strong>E</strong> The wave tank activities provided practice in survival techniques.</p>",
  "correctAnswer": "C, E",
  "audioId": "6ad718736647",
  "audioPath": "assets/6ad718736647.mp3",
  "tableData": null,
  "sourceEvidence": {
    "sourceFile": "/Users/arunyagoojar/Downloads/ielts-website/ielts-listening-test-198/index.html",
    "sourceHash": "f181435ff36a2ab34230c36a8abf2b1ad89e8e6239d619970a7ec3d4a866f059"
  },
  "status": "VERIFIED"
}