{
  "id": "LIS-437a34d0-test_0-S1-Q08",
  "module": "LISTENING",
  "testId": "LIS-437a34d0-test_0",
  "testType": "ACADEMIC",
  "sectionId": "LIS-437a34d0-test_0-S1",
  "sectionNumber": 1,
  "passageId": null,
  "passageNumber": null,
  "groupId": "LIS-437a34d0-test_0-S1-G1",
  "questionNumber": 8,
  "questionType": "NOTE_COMPLETION",
  "inputType": "INLINE_BLANK",
  "prompt": "Only uses [INLINE_INPUT_8] ingredients",
  "options": [],
  "sharedInstruction": "Part 1: Questions 1-10Complete the notes below. WriteONE WORD AND/ OR A NUMBERfor each answer.",
  "sharedContent": "<table style=\"border-collapse: collapse; width: 100%;\"><tbody><tr><td style=\"width: 19.973%; border-style: solid; border-color: #000000;\" width=\"148\"><span style=\"color: #000000;\"><strong>Name of restaurant</strong></span></td><td style=\"width: 19.973%; border-style: solid; border-color: #000000;\" width=\"148\"><span style=\"color: #000000;\"><strong>Location </strong></span></td><td style=\"width: 21.9973%; border-style: solid; border-color: #000000;\" width=\"148\"><span style=\"color: #000000;\"><strong>Reason for recommendation</strong></span></td><td style=\"width: 19.973%; border-style: solid; border-color: #000000;\" width=\"148\"><span style=\"color: #000000;\"><strong>Other comments</strong></span></td></tr><tr><td style=\"width: 19.973%; border-style: solid; border-color: #000000;\" width=\"148\"><span style=\"color: #000000;\">The Junction</span></td><td style=\"width: 19.973%; border-style: solid; border-color: #000000;\" width=\"148\"> <p><span style=\"color: #000000;\">Greyson Street, near the station</span></p></td><td style=\"width: 21.9973%; border-style: solid; border-color: #000000;\" width=\"148\"><span style=\"color: #000000;\">Good for people who are especially keen on (1) <input name=\"fname\" type=\"text\"/></span></td><td style=\"width: 19.973%; border-style: solid; border-color: #000000;\" width=\"148\"><span style=\"color: #000000;\">Quite expensive</span><p> </p><p><span style=\"color: #000000;\">The (2)<input name=\"fname\" type=\"text\"/> is a good place for a drink</span></p><p> </p></td></tr><tr><td style=\"width: 19.973%; border-style: solid; border-color: #000000;\" width=\"148\"><span style=\"color: #000000;\">Paloma</span></td><td style=\"width: 19.973%; border-style: solid; border-color: #000000;\" width=\"148\"> <p> </p><p><span style=\"color: #000000;\">In Bow Street next to the cinema</span></p></td><td style=\"width: 21.9973%; border-style: solid; border-color: #000000;\" width=\"148\"><span style=\"color: #000000;\">(3) <input name=\"fname\" type=\"text\"/> food, good for sharing</span></td><td style=\"width: 19.973%; border-style: solid; border-color: #000000;\" width=\"148\"><span style=\"color: #000000;\">Staff are very friendly</span><p> </p><p><span style=\"color: #000000;\">Need to pay £ 50 deposit</span></p><p> </p><p><span style=\"color: #000000;\">A limited selection of (4) <input name=\"fname\" type=\"text\"/></span></p><p> </p><p><span style=\"color: #000000;\">Food on the menu</span></p><p> </p></td></tr><tr><td style=\"width: 19.973%; border-style: solid; border-color: #000000;\" width=\"148\"><span style=\"color: #000000;\">The (5) <input name=\"fname\" type=\"text\"/></span></td><td style=\"width: 19.973%; border-style: solid; border-color: #000000;\" width=\"148\"><span style=\"color: #000000;\">At the top of a (6) <input name=\"fname\" type=\"text\"/></span></td><td style=\"width: 21.9973%; border-style: solid; border-color: #000000;\" width=\"148\"><span style=\"color: #000000;\">A famous chef</span><p> </p><p><span style=\"color: #000000;\">All the (7) <input name=\"fname\" type=\"text\"/> are very good</span></p><p> </p><p><span style=\"color: #000000;\">Only uses (8) <input name=\"fname\" type=\"text\"/> ingredients</span></p><p> </p></td><td style=\"width: 19.973%; border-style: solid; border-color: #000000;\" width=\"148\"><span style=\"color: #000000;\">Set lunch costs (9) <input name=\"fname\" type=\"text\"/> per person</span><p> </p><p><span style=\"color: #000000;\">Portions probably of (10) <input name=\"fname\" type=\"text\"/> size</span></p></td></tr></tbody></table><p style=\"text-align: justify;\"><span style=\"text-decoration: underline;\"><strong><span style=\"color: #000000; text-decoration: underline;\"><br/> <br/>\n<br/>\n<br/> </span></strong></span></p>",
  "correctAnswer": "UNKNOWN",
  "audioId": "ddfebdad52be",
  "audioPath": "assets/ddfebdad52be.mp3",
  "tableData": {
    "title": "",
    "headers": [],
    "rows": [
      [
        "Name of restaurant",
        "Location",
        "Reason for recommendation",
        "Other comments"
      ],
      [
        "The Junction",
        "Greyson Street, near the station",
        "Good for people who are especially keen on (1)",
        "Quite expensive The (2) is a good place for a drink"
      ],
      [
        "Paloma",
        "In Bow Street next to the cinema",
        "(3) food, good for sharing",
        "Staff are very friendly Need to pay £ 50 deposit A limited selection of (4) Food on the menu"
      ],
      [
        "The (5)",
        "At the top of a (6)",
        "A famous chef All the (7) are very good Only uses (8) ingredients",
        "Set lunch costs (9) per person Portions probably of (10) size"
      ]
    ]
  },
  "sourceEvidence": {
    "sourceFile": "/Users/arunyagoojar/Downloads/ielts-website/ielts-listening-test-201/index.html",
    "sourceHash": "437a34d0547374842fd08f5ca3a0393a6d5dfbbad284bae91a17c03f43f6dc01"
  },
  "status": "VERIFIED"
}