{
  "id": "LIS-4ab6af0d-test_0-S4-Q32",
  "module": "LISTENING",
  "testId": "LIS-4ab6af0d-test_0",
  "testType": "ACADEMIC",
  "sectionId": "LIS-4ab6af0d-test_0-S4",
  "sectionNumber": 4,
  "passageId": null,
  "passageNumber": null,
  "groupId": "LIS-4ab6af0d-test_0-S4-G1",
  "questionNumber": 32,
  "questionType": "NOTE_COMPLETION",
  "inputType": "INLINE_BLANK",
  "prompt": "Bullying in the workplace costs the [INLINE_INPUT_32] up to £4 billion a year.",
  "options": [],
  "sharedInstruction": "Part 4: Questions 31-33",
  "sharedContent": "<p>Write <strong>NO MORE THAN TWO WORDS</strong> for each answer.</p><p>Notes:<br/>The speaker specializes in management <strong>(31)</strong> <input name=\"fname\" type=\"text\"/><br/>Bullying in the workplace costs the <strong>(32)</strong> <input name=\"fname\" type=\"text\"/> up to £4 billion a year.<br/>Bullying is caused by<br/>• insufficient experience,<br/>• insecurity, or<br/>• a lack of <strong>(33)</strong> <input name=\"fname\" type=\"text\"/> on the part of managers.</p>",
  "correctAnswer": "british economy",
  "audioId": "7bd52db8086d",
  "audioPath": "assets/7bd52db8086d.mp3",
  "tableData": null,
  "sourceEvidence": {
    "sourceFile": "/Users/arunyagoojar/Downloads/ielts-website/ielts-listening-test-56/index.html",
    "sourceHash": "4ab6af0d5cf0f0edb7d8c433a7254dcd31263c710d6804f4b7421b3789222ab5"
  },
  "status": "VERIFIED"
}